{
  "type": "relationship",
  "id": "relation.delivery-request-precedes-evidence",
  "kind": "references",
  "sourceRef": "evidence.delivery-note",
  "targetRef": "request.delivery",
  "label": "凭证引用形成依据",
  "notes": "由申请与确认、确认与具体补充凭证的两组一对一关系确定，每份申请关联一份该业务凭证。",
  "sourceCardinality": {
    "min": 1,
    "max": 1
  },
  "targetCardinality": {
    "min": 1,
    "max": 1
  }
}
