{
  "type": "relationship",
  "id": "relation.invoice-evidence-precedes-confirmation",
  "kind": "references",
  "sourceRef": "confirmation.invoice",
  "targetRef": "evidence.invoice",
  "label": "开票确认引用发票",
  "sourceCardinality": { "min": 1, "max": 1 },
  "targetCardinality": { "min": 1, "max": 1 }
}
