{
  "type": "relationship",
  "id": "relation.contract-precedes-payment-request",
  "kind": "references",
  "sourceRef": "request.payment",
  "targetRef": "contract.product-procurement",
  "label": "凭证引用形成依据",
  "sourceCardinality": {
    "min": 1,
    "max": 1
  },
  "targetCardinality": {
    "min": 1,
    "max": 1
  }
}
