{
  "type": "relationship",
  "id": "relation.wechat-request-precedes-confirmation",
  "label": "凭证引用形成依据",
  "kind": "references",
  "sourceRef": "confirmation.wechat-payment",
  "targetRef": "request.wechat-payment",
  "sourceCardinality": {
    "min": 1,
    "max": 1
  },
  "targetCardinality": {
    "min": 1,
    "max": 1
  }
}
